{
  "schema_version": "1.0.0",
  "id": "00000000-0000-0000-0000-000000000301",
  "product_pack_id": "fresh_ground_beef",
  "base_version": "1.0.0",
  "proposed_version": "1.1.0",
  "status": "draft",
  "revision": 1,
  "config": {},
  "report_blueprint": {},
  "validation_summary": {
    "status": "not_run",
    "passed": 0,
    "failed": 0,
    "warnings": 0,
    "last_run_id": null
  },
  "created_by": "admin@cpghero.com",
  "created_at": "2026-08-11T00:00:00Z",
  "updated_at": "2026-08-11T00:00:00Z"
}
